{
  "schema_version": "0.1.0",
  "record_type": "EvaluationRequest",
  "document_status": "draft",
  "payload": {
    "request_id": null,
    "question": null,
    "targets": null,
    "truth_bindings": null,
    "metric_requests": null,
    "matching_rules": null,
    "output_plan": null,
    "confirmation": null,
    "accepted_limitations": null
  },
  "unresolved_items": [
    {
      "field": "/payload",
      "reason": "尚未填写并核对本对象所需信息。",
      "affected_actions": [
        "字段定稿；不授予计算许可"
      ],
      "question": "先从唯一检测包和证据自主选择全部可计算指标；只有输入对象或证据语义无法裁决时才一次性询问。未知真值保持未知，不据空标签推断纯背景。"
    }
  ]
}
